<?xml version="1.0" encoding="UTF-8"?>
<alumnos xmlns:xsi="http://www.w3.org/2001/XMLSchema-instance"
    xsi:noNamespaceSchemaLocation="file:/C:/Users/pagaliv/Documents/GitHub/practicas-PL/practica3/alumno.xsd">
    <alumno>
        <datosPersonales>
            <nombre>Paco</nombre>
            <apellido>meloso</apellido>
            <edad>3</edad>
            <direccion>detector de humos</direccion>
        </datosPersonales>
        <asignaturas>
            <asignatura>
                <nombreAsignatura>ccr</nombreAsignatura>
                <creditos>3</creditos>
                <profesor></profesor>
                <calificacion>6</calificacion>
            </asignatura>
            <asignatura>
                <nombreAsignatura>CCT</nombreAsignatura>
                <creditos>3</creditos>
                <profesor></profesor>
                <calificacion>3</calificacion>
            </asignatura>
        </asignaturas>
    </alumno>
</alumnos>